{
  "$schema": "../../schemas/run-manifest.schema.json",
  "run_id": "run-0001",
  "git_commit": "2173717",
  "three_version": "0.185.0",
  "determinism_regime": "A-PinnedBrowser",
  "backend": "webgpu",
  "seed": 1337,
  "viewport": {
    "width": 1920,
    "height": 1080,
    "device_pixel_ratio": 1.0
  },
  "device_tier": "tier-1-discrete-gpu",
  "scenarios": [
    {
      "scenario_id": "rep-11a-shrine-brass-vow",
      "relic_branch": "brass_vow",
      "seed": 1337,
      "state_hash": "sha256:4a8e9b2d1c3f5a7e6b8d0c2e4f6a8b0c2d4e6f8a0b2c4d6e8f0a1b2c3d4e5f60",
      "audio_hash": "sha256:9f8e7d6c5b4a3f2e1d0c9b8a7f6e5d4c3b2a1f0e9d8c7b6a5f4e3d2c1b0a9f80",
      "geometry_hash": "sha256:1b2c3d4e5f6a7b8c9d0e1f2a3b4c5d6e7f8a9b0c1d2e3f4a5b6c7d8e9f0a1b20",
      "passed": true
    },
    {
      "scenario_id": "rep-11b-shrine-ash-thread",
      "relic_branch": "ash_thread",
      "seed": 1337,
      "state_hash": "sha256:7c6d5e4f3a2b1c0d9e8f7a6b5c4d3e2f1a0b9c8d7e6f5a4b3c2d1e0f9a8b7c60",
      "audio_hash": "sha256:9f8e7d6c5b4a3f2e1d0c9b8a7f6e5d4c3b2a1f0e9d8c7b6a5f4e3d2c1b0a9f80",
      "geometry_hash": "sha256:1b2c3d4e5f6a7b8c9d0e1f2a3b4c5d6e7f8a9b0c1d2e3f4a5b6c7d8e9f0a1b20",
      "passed": true
    },
    {
      "scenario_id": "rep-11c-shrine-vacant-name",
      "relic_branch": "vacant_name",
      "seed": 1337,
      "state_hash": "sha256:2e3f4a5b6c7d8e9f0a1b2c3d4e5f6a7b8c9d0e1f2a3b4c5d6e7f8a9b0c1d2e30",
      "audio_hash": "sha256:9f8e7d6c5b4a3f2e1d0c9b8a7f6e5d4c3b2a1f0e9d8c7b6a5f4e3d2c1b0a9f80",
      "geometry_hash": "sha256:1b2c3d4e5f6a7b8c9d0e1f2a3b4c5d6e7f8a9b0c1d2e3f4a5b6c7d8e9f0a1b20",
      "passed": true
    }
  ],
  "metrics": {
    "frame_time_p50_ms": 8.4,
    "frame_time_p95_ms": 14.2,
    "frame_time_p99_ms": 18.1,
    "max_draw_calls": 184,
    "max_triangles": 312400,
    "gpu_memory_mb": 268.5,
    "integrated_lufs": -16.2,
    "true_peak_dbtp": -1.4
  },
  "critic_verdicts": {
    "visual_critic": "pass",
    "audio_critic": "pass",
    "gameplay_critic": "pass",
    "provenance_critic": "pass"
  },
  "human_signoff": {
    "authority": "Emily Paradox (@iamemily2050)",
    "status": "approved",
    "signed_at": "2026-07-27T12:00:00Z",
    "notes": "Golden reference fixture validating Draft 2020-12 RunManifest schema across all 3 shrine relic branches (Brass Vow, Ash Thread, Vacant Name)."
  },
  "cost_ledger": {
    "total_tokens": 384200,
    "wall_clock_seconds": 1140,
    "subagent_invocations": 9,
    "repair_cycles": 1
  },
  "provenance": {
    "external_network_requests": 0,
    "downloaded_assets_count": 0,
    "procedural_generators_verified": true
  },
  "verdict": "accepted"
}
